{
  "id": "combo-favicon-loading-emerald",
  "name": "Favicon + Loading — Emerald",
  "category": "combo",
  "tags": [
    "combo",
    "brand",
    "favicon",
    "spinner",
    "logo",
    "text",
    "theme",
    "emerald"
  ],
  "tech": "css",
  "framework": "none",
  "dependencies": [],
  "variables": {
    "--lc-size": "74px",
    "--lc-color": "#10b981",
    "--lc-text": "#64748b",
    "--lc-speed": "1s"
  },
  "source": {
    "name": "Loading Companion",
    "url": "https://github.com/loading-companion",
    "author": "Loading Companion"
  },
  "license": "MIT",
  "copyright": null,
  "generated": true,
  "baseId": "combo-favicon-loading"
}
