{
  "id": "combo-favicon-bounce-violet",
  "name": "Favicon Bounce + Dots — Violet",
  "category": "combo",
  "tags": [
    "combo",
    "brand",
    "favicon",
    "bounce",
    "logo",
    "dots",
    "theme",
    "violet"
  ],
  "tech": "css",
  "framework": "none",
  "dependencies": [],
  "variables": {
    "--lc-color": "#8b5cf6",
    "--lc-text": "#64748b",
    "--lc-speed": ".9s"
  },
  "source": {
    "name": "Loading Companion",
    "url": "https://github.com/loading-companion",
    "author": "Loading Companion"
  },
  "license": "MIT",
  "copyright": null,
  "generated": true,
  "baseId": "combo-favicon-bounce"
}
