{
  "id": "combo-card-list-emerald",
  "name": "Skeleton List + More — Emerald",
  "category": "combo",
  "tags": [
    "combo",
    "skeleton",
    "spinner",
    "list",
    "theme",
    "emerald"
  ],
  "tech": "css",
  "framework": "none",
  "dependencies": [],
  "variables": {
    "--lc-color": "#10b981",
    "--lc-base": "#e2e8f0",
    "--lc-highlight": "#f1f5f9",
    "--lc-text": "#94a3b8",
    "--lc-speed": "1.4s"
  },
  "source": {
    "name": "Loading Companion",
    "url": "https://github.com/loading-companion",
    "author": "Loading Companion"
  },
  "license": "MIT",
  "copyright": null,
  "generated": true,
  "baseId": "combo-card-list"
}
