{
  "id": "td-dot-stretching-teal",
  "name": "Dot Stretching — Teal",
  "category": "dots",
  "tags": [
    "stretch",
    "scale-x",
    "single",
    "theme",
    "teal"
  ],
  "tech": "css",
  "framework": "none",
  "dependencies": [],
  "variables": {
    "--lc-size": "14px",
    "--lc-color": "#14b8a6",
    "--lc-speed": "1.2s"
  },
  "source": {
    "name": "Three Dots",
    "url": "https://github.com/nzbin/three-dots",
    "author": "nzbin"
  },
  "license": "MIT",
  "copyright": "Copyright (c) 2018 nzbin",
  "generated": true,
  "baseId": "td-dot-stretching"
}
