{
  "id": "combo-app-boot-amber",
  "name": "App Boot — Amber",
  "category": "combo",
  "tags": [
    "combo",
    "multi",
    "spinner",
    "logo",
    "dots",
    "text",
    "theme",
    "amber"
  ],
  "tech": "css",
  "framework": "none",
  "dependencies": [],
  "variables": {
    "--lc-color": "#f59e0b",
    "--lc-text": "#64748b",
    "--lc-speed": "1s"
  },
  "source": {
    "name": "Loading Companion",
    "url": "https://github.com/loading-companion",
    "author": "Loading Companion"
  },
  "license": "MIT",
  "copyright": null,
  "generated": true,
  "baseId": "combo-app-boot"
}
