{
  "id": "spinner-blades-teal",
  "name": "Fading Blades — Teal",
  "category": "spinner",
  "tags": [
    "blades",
    "fade",
    "ios",
    "twelve",
    "theme",
    "teal"
  ],
  "tech": "css",
  "framework": "none",
  "dependencies": [],
  "variables": {
    "--lc-size": "40px",
    "--lc-color": "#14b8a6",
    "--lc-speed": "1s"
  },
  "source": {
    "name": "Loading Companion",
    "url": "https://github.com/loading-companion",
    "author": "Loading Companion"
  },
  "license": "MIT",
  "copyright": null,
  "generated": true,
  "baseId": "spinner-blades"
}
