{
  "id": "combo-loading-screen-emerald",
  "name": "Loading Screen — Emerald",
  "category": "combo",
  "tags": [
    "combo",
    "multi",
    "spinner",
    "text",
    "bar",
    "theme",
    "emerald"
  ],
  "tech": "css",
  "framework": "none",
  "dependencies": [],
  "variables": {
    "--lc-color": "#10b981",
    "--lc-track": "#e2e8f0",
    "--lc-text": "#334155",
    "--lc-speed": "1s"
  },
  "source": {
    "name": "Loading Companion",
    "url": "https://github.com/loading-companion",
    "author": "Loading Companion"
  },
  "license": "MIT",
  "copyright": null,
  "generated": true,
  "baseId": "combo-loading-screen"
}
