{
  "id": "svg-circle-dash-green",
  "name": "SVG Dash Circle — Green",
  "category": "svg",
  "tags": [
    "dash",
    "rotate",
    "circle",
    "theme",
    "green"
  ],
  "tech": "svg",
  "framework": "none",
  "dependencies": [],
  "variables": {
    "--lc-size": "48px",
    "--lc-color": "#22c55e",
    "--lc-speed": "1s"
  },
  "source": {
    "name": "Loading Companion",
    "url": "https://github.com/loading-companion",
    "author": "Loading Companion"
  },
  "license": "MIT",
  "copyright": null,
  "generated": true,
  "baseId": "svg-circle-dash"
}
