{
  "id": "combo-favicon-progress-indigo",
  "name": "Favicon + Progress % — Indigo",
  "category": "combo",
  "tags": [
    "combo",
    "brand",
    "favicon",
    "ring",
    "logo",
    "percent",
    "theme",
    "indigo"
  ],
  "tech": "css+js",
  "framework": "none",
  "dependencies": [],
  "variables": {
    "--lc-size": "74px",
    "--lc-color": "#6366f1",
    "--lc-track": "#e2e8f0",
    "--lc-text": "#64748b"
  },
  "source": {
    "name": "Loading Companion",
    "url": "https://github.com/loading-companion",
    "author": "Loading Companion"
  },
  "license": "MIT",
  "copyright": null,
  "generated": true,
  "baseId": "combo-favicon-progress"
}
