{
  "id": "pulse-grid-teal",
  "name": "Pulse Grid — Teal",
  "category": "pulse",
  "tags": [
    "grid",
    "pulse",
    "nine",
    "theme",
    "teal"
  ],
  "tech": "css",
  "framework": "none",
  "dependencies": [],
  "variables": {
    "--lc-size": "12px",
    "--lc-color": "#14b8a6",
    "--lc-speed": "1.3s"
  },
  "source": {
    "name": "Loading Companion",
    "url": "https://github.com/loading-companion",
    "author": "Loading Companion"
  },
  "license": "MIT",
  "copyright": null,
  "generated": true,
  "baseId": "pulse-grid"
}
