{
  "id": "combo-favicon-orbit-rose",
  "name": "Favicon + Orbit Dots — Rose",
  "category": "combo",
  "tags": [
    "combo",
    "brand",
    "favicon",
    "orbit",
    "logo",
    "dots",
    "theme",
    "rose"
  ],
  "tech": "css",
  "framework": "none",
  "dependencies": [],
  "variables": {
    "--lc-size": "74px",
    "--lc-color": "#f43f5e",
    "--lc-text": "#64748b",
    "--lc-speed": "1.4s"
  },
  "source": {
    "name": "Loading Companion",
    "url": "https://github.com/loading-companion",
    "author": "Loading Companion"
  },
  "license": "MIT",
  "copyright": null,
  "generated": true,
  "baseId": "combo-favicon-orbit"
}
