{
  "id": "bars-equalizer-rose",
  "name": "Equalizer — Rose",
  "category": "bars",
  "tags": [
    "equalizer",
    "audio",
    "scale",
    "theme",
    "rose"
  ],
  "tech": "css",
  "framework": "none",
  "dependencies": [],
  "variables": {
    "--lc-size": "8px",
    "--lc-height": "40px",
    "--lc-color": "#f43f5e",
    "--lc-speed": "1s"
  },
  "source": {
    "name": "Loading Companion",
    "url": "https://github.com/loading-companion",
    "author": "Loading Companion"
  },
  "license": "MIT",
  "copyright": null,
  "generated": true,
  "baseId": "bars-equalizer"
}
