{
  "id": "combo-spinner-subtext-indigo",
  "name": "Spinner + Title + Subtitle — Indigo",
  "category": "combo",
  "tags": [
    "combo",
    "spinner",
    "text",
    "two-line",
    "theme",
    "indigo"
  ],
  "tech": "css",
  "framework": "none",
  "dependencies": [],
  "variables": {
    "--lc-size": "38px",
    "--lc-color": "#6366f1",
    "--lc-text": "#334155",
    "--lc-speed": "1s"
  },
  "source": {
    "name": "Loading Companion",
    "url": "https://github.com/loading-companion",
    "author": "Loading Companion"
  },
  "license": "MIT",
  "copyright": null,
  "generated": true,
  "baseId": "combo-spinner-subtext"
}
