{
  "id": "spinner-dots-circle-cyan",
  "name": "Circling Dots — Cyan",
  "category": "spinner",
  "tags": [
    "dots",
    "circle",
    "fade",
    "ios",
    "theme",
    "cyan"
  ],
  "tech": "css",
  "framework": "none",
  "dependencies": [],
  "variables": {
    "--lc-size": "48px",
    "--lc-color": "#06b6d4",
    "--lc-speed": "1s"
  },
  "source": {
    "name": "Loading Companion",
    "url": "https://github.com/loading-companion",
    "author": "Loading Companion"
  },
  "license": "MIT",
  "copyright": null,
  "generated": true,
  "baseId": "spinner-dots-circle"
}
