{
  "id": "spinner-propeller-rose",
  "name": "Propeller — Rose",
  "category": "spinner",
  "tags": [
    "blades",
    "rotate",
    "three",
    "theme",
    "rose"
  ],
  "tech": "css",
  "framework": "none",
  "dependencies": [],
  "variables": {
    "--lc-size": "44px",
    "--lc-color": "#f43f5e",
    "--lc-speed": ".9s"
  },
  "source": {
    "name": "Loading Companion",
    "url": "https://github.com/loading-companion",
    "author": "Loading Companion"
  },
  "license": "MIT",
  "copyright": null,
  "generated": true,
  "baseId": "spinner-propeller"
}
