{
  "id": "spinner-segment-gap-red",
  "name": "Segment Gap — Red",
  "category": "spinner",
  "tags": [
    "conic",
    "gap",
    "rotate",
    "theme",
    "red"
  ],
  "tech": "css",
  "framework": "none",
  "dependencies": [],
  "variables": {
    "--lc-size": "46px",
    "--lc-color": "#ef4444",
    "--lc-speed": "1s"
  },
  "source": {
    "name": "Loading Companion",
    "url": "https://github.com/loading-companion",
    "author": "Loading Companion"
  },
  "license": "MIT",
  "copyright": null,
  "generated": true,
  "baseId": "spinner-segment-gap"
}
