{
  "id": "text-underline-cyan",
  "name": "Underline Sweep — Cyan",
  "category": "text",
  "tags": [
    "text",
    "underline",
    "sweep",
    "theme",
    "cyan"
  ],
  "tech": "css",
  "framework": "none",
  "dependencies": [],
  "variables": {
    "--lc-size": "18px",
    "--lc-color": "#06b6d4",
    "--lc-speed": "1.6s"
  },
  "source": {
    "name": "Loading Companion",
    "url": "https://github.com/loading-companion",
    "author": "Loading Companion"
  },
  "license": "MIT",
  "copyright": null,
  "generated": true,
  "baseId": "text-underline"
}
