{
  "id": "combo-favicon-dual-ring-red",
  "name": "Favicon + Dual Ring — Red",
  "category": "combo",
  "tags": [
    "combo",
    "brand",
    "favicon",
    "spinner",
    "logo",
    "dual",
    "theme",
    "red"
  ],
  "tech": "css",
  "framework": "none",
  "dependencies": [],
  "variables": {
    "--lc-size": "76px",
    "--lc-color": "#ef4444",
    "--lc-text": "#64748b",
    "--lc-speed": "1.1s"
  },
  "source": {
    "name": "Loading Companion",
    "url": "https://github.com/loading-companion",
    "author": "Loading Companion"
  },
  "license": "MIT",
  "copyright": null,
  "generated": true,
  "baseId": "combo-favicon-dual-ring"
}
