{
  "id": "combo-progress-eta-blue",
  "name": "Bar + ETA — Blue",
  "category": "combo",
  "tags": [
    "combo",
    "progress",
    "eta",
    "text",
    "theme",
    "blue"
  ],
  "tech": "css+js",
  "framework": "none",
  "dependencies": [],
  "variables": {
    "--lc-size": "190px",
    "--lc-color": "#3b82f6",
    "--lc-track": "#e2e8f0",
    "--lc-text": "#64748b"
  },
  "source": {
    "name": "Loading Companion",
    "url": "https://github.com/loading-companion",
    "author": "Loading Companion"
  },
  "license": "MIT",
  "copyright": null,
  "generated": true,
  "baseId": "combo-progress-eta"
}
