{
  "id": "combo-dots-percent-orange",
  "name": "Dots + Percent — Orange",
  "category": "combo",
  "tags": [
    "combo",
    "dots",
    "percent",
    "counter",
    "theme",
    "orange"
  ],
  "tech": "css+js",
  "framework": "none",
  "dependencies": [],
  "variables": {
    "--lc-color": "#f97316",
    "--lc-speed": ".6s"
  },
  "source": {
    "name": "Loading Companion",
    "url": "https://github.com/loading-companion",
    "author": "Loading Companion"
  },
  "license": "MIT",
  "copyright": null,
  "generated": true,
  "baseId": "combo-dots-percent"
}
